{
  "schema_version": "1.0",
  "model": "subjects/vehicles/vehicle.touring-motorcycle/0.1.0/model/touring-bike.glb",
  "preview": "subjects/vehicles/vehicle.touring-motorcycle/0.1.0/preview/thumbnail.webp",
  "files": [
    {
      "path": "subjects/vehicles/vehicle.touring-motorcycle/0.1.0/model/touring-bike.glb",
      "sha256": "16d3eff62f9437a74fadd6d77b443c1b39b6cff3c931b40e7d22845451ff72cb",
      "byte_length": 66856,
      "format": "glb",
      "role": "model",
      "source_path": "assets/three-creator/presets/vehicles/touring-bike.glb",
      "reused_by": [
        "vehicle.touring-motorcycle"
      ]
    },
    {
      "path": "subjects/vehicles/vehicle.touring-motorcycle/0.1.0/preview/thumbnail.webp",
      "sha256": "026cc2740f87a6ca48124283c8ee2ddb012fc57836609478972205f97869d629",
      "byte_length": 10416,
      "format": "webp",
      "role": "rendered_preview",
      "source_path": "viewer:Chrome/Three.js",
      "reused_by": [
        "vehicle.touring-motorcycle"
      ]
    }
  ],
  "inspection": {
    "format": "glb",
    "gltf_version": "2.0",
    "nodes": 22,
    "meshes": 16,
    "materials": 6,
    "skins": 0,
    "bones": [],
    "clips": [],
    "triangles": 1260,
    "extensions": [
      "KHR_materials_unlit"
    ],
    "external_uris": []
  },
  "animations": [],
  "model_logical_path": "vehicles/touring-bike.glb"
}
